Place,Tags
CGV 신촌아트레온,CGVSinchonCinema SinchonMovieDates ArtreonCinemaVibes HighballAtSinchon CinematicSinchon SinchonFilmExperience ArtreonCulture MovieMagicSinchon SinchonCinemaLovers CGVArtreonHighSinchon
복합문화공간 몽향,ChangcheonCultureHub MongHyangMagic SeodaemunStage UndergroundArtScene SeoulCultureSpot PerformingArtsSeoul CitywideCreativity TheaterInSeoul KoreanCulturalMix ArtisticSeodaemun
서강대학교 메리홀 대극장,SogangStageInnovation MaryHallSpotlight SogangCreativityHub MaryHallMoments HeartOfKoreanArt MaryHallMasterpieces SogangCulturalJourney TheaterByTheHan
예스24 원더로크홀,Yes24WonderlockHall JangBeomJuneLive IntimateGigsShinchon AcousticEvenings CinemaConcertSeries SinchonMusicSpot HandshakeWithBeomJune EveningWithJangBeomJune ConcertsInShinchon MusicUnderTheStarsUpInside24
극장PLOT,PlotTheaterSeoul SeodaemunStage UndergroundArtScene PlotCulturalHub DaehyunDrama SeoulArtsAlive PlotPerformances ChangcheonCulture SeoulSubterraneanShows CreativePlotSeoul
